{
 "schemaVersion": 1,
 "seed": 3999547794,
 "day": 3,
 "date": "2026-10-18",
 "subscriberCount": 118,
 "peakPopulation": 118,
 "countSource": "public",
 "houses": [
  {
   "id": 0,
   "plot": 0,
   "capacity": 1,
   "status": "occupied",
   "builtDay": 2,
   "occupants": [
    0
   ]
  },
  {
   "id": 1,
   "plot": 1,
   "capacity": 1,
   "status": "occupied",
   "builtDay": 2,
   "occupants": [
    1
   ]
  },
  {
   "id": 2,
   "plot": 2,
   "capacity": 1,
   "status": "occupied",
   "builtDay": 2,
   "occupants": [
    2
   ]
  },
  {
   "id": 3,
   "plot": 3,
   "capacity": 1,
   "status": "occupied",
   "builtDay": 2,
   "occupants": [
    3
   ]
  },
  {
   "id": 4,
   "plot": 4,
   "capacity": 1,
   "status": "occupied",
   "builtDay": 2,
   "occupants": [
    4
   ]
  },
  {
   "id": 5,
   "plot": 5,
   "capacity": 1,
   "status": "occupied",
   "builtDay": 2,
   "occupants": [
    5
   ]
  },
  {
   "id": 6,
   "plot": 6,
   "capacity": 1,
   "status": "occupied",
   "builtDay": 2,
   "occupants": [
    6
   ]
  },
  {
   "id": 7,
   "plot": 7,
   "capacity": 1,
   "status": "occupied",
   "builtDay": 2,
   "occupants": [
    7
   ]
  },
  {
   "id": 8,
   "plot": 8,
   "capacity": 1,
   "status": "occupied",
   "builtDay": 2,
   "occupants": [
    8
   ]
  },
  {
   "id": 9,
   "plot": 9,
   "capacity": 1,
   "status": "occupied",
   "builtDay": 2,
   "occupants": [
    9
   ]
  },
  {
   "id": 10,
   "plot": 10,
   "capacity": 1,
   "status": "occupied",
   "builtDay": 2,
   "occupants": [
    10
   ]
  },
  {
   "id": 11,
   "plot": 11,
   "capacity": 1,
   "status": "occupied",
   "builtDay": 2,
   "occupants": [
    11
   ]
  },
  {
   "id": 12,
   "plot": 12,
   "capacity": 1,
   "status": "occupied",
   "builtDay": 2,
   "occupants": [
    12
   ]
  },
  {
   "id": 13,
   "plot": 13,
   "capacity": 1,
   "status": "occupied",
   "builtDay": 2,
   "occupants": [
    13
   ]
  },
  {
   "id": 14,
   "plot": 14,
   "capacity": 1,
   "status": "occupied",
   "builtDay": 2,
   "occupants": [
    14
   ]
  },
  {
   "id": 15,
   "plot": 15,
   "capacity": 1,
   "status": "occupied",
   "builtDay": 2,
   "occupants": [
    15
   ]
  },
  {
   "id": 16,
   "plot": 16,
   "capacity": 1,
   "status": "occupied",
   "builtDay": 2,
   "occupants": [
    16
   ]
  },
  {
   "id": 17,
   "plot": 17,
   "capacity": 1,
   "status": "occupied",
   "builtDay": 2,
   "occupants": [
    17
   ]
  },
  {
   "id": 18,
   "plot": 18,
   "capacity": 1,
   "status": "occupied",
   "builtDay": 2,
   "occupants": [
    18
   ]
  },
  {
   "id": 19,
   "plot": 19,
   "capacity": 1,
   "status": "occupied",
   "builtDay": 2,
   "occupants": [
    19
   ]
  },
  {
   "id": 20,
   "plot": 20,
   "capacity": 1,
   "status": "occupied",
   "builtDay": 2,
   "occupants": [
    20
   ]
  },
  {
   "id": 21,
   "plot": 21,
   "capacity": 1,
   "status": "occupied",
   "builtDay": 2,
   "occupants": [
    21
   ]
  },
  {
   "id": 22,
   "plot": 22,
   "capacity": 1,
   "status": "occupied",
   "builtDay": 2,
   "occupants": [
    22
   ]
  },
  {
   "id": 23,
   "plot": 23,
   "capacity": 1,
   "status": "occupied",
   "builtDay": 2,
   "occupants": [
    23
   ]
  },
  {
   "id": 24,
   "plot": 24,
   "capacity": 1,
   "status": "occupied",
   "builtDay": 2,
   "occupants": [
    24
   ]
  },
  {
   "id": 25,
   "plot": 25,
   "capacity": 1,
   "status": "occupied",
   "builtDay": 2,
   "occupants": [
    25
   ]
  },
  {
   "id": 26,
   "plot": 26,
   "capacity": 1,
   "status": "occupied",
   "builtDay": 2,
   "occupants": [
    26
   ]
  },
  {
   "id": 27,
   "plot": 27,
   "capacity": 1,
   "status": "occupied",
   "builtDay": 2,
   "occupants": [
    27
   ]
  },
  {
   "id": 28,
   "plot": 28,
   "capacity": 1,
   "status": "occupied",
   "builtDay": 2,
   "occupants": [
    28
   ]
  },
  {
   "id": 29,
   "plot": 29,
   "capacity": 1,
   "status": "occupied",
   "builtDay": 2,
   "occupants": [
    29
   ]
  },
  {
   "id": 30,
   "plot": 30,
   "capacity": 1,
   "status": "occupied",
   "builtDay": 2,
   "occupants": [
    30
   ]
  },
  {
   "id": 31,
   "plot": 31,
   "capacity": 1,
   "status": "occupied",
   "builtDay": 2,
   "occupants": [
    31
   ]
  },
  {
   "id": 32,
   "plot": 32,
   "capacity": 1,
   "status": "occupied",
   "builtDay": 2,
   "occupants": [
    32
   ]
  },
  {
   "id": 33,
   "plot": 33,
   "capacity": 1,
   "status": "occupied",
   "builtDay": 2,
   "occupants": [
    33
   ]
  },
  {
   "id": 34,
   "plot": 34,
   "capacity": 1,
   "status": "occupied",
   "builtDay": 2,
   "occupants": [
    34
   ]
  },
  {
   "id": 35,
   "plot": 35,
   "capacity": 1,
   "status": "occupied",
   "builtDay": 2,
   "occupants": [
    35
   ]
  },
  {
   "id": 36,
   "plot": 36,
   "capacity": 1,
   "status": "occupied",
   "builtDay": 2,
   "occupants": [
    36
   ]
  },
  {
   "id": 37,
   "plot": 37,
   "capacity": 1,
   "status": "occupied",
   "builtDay": 2,
   "occupants": [
    37
   ]
  },
  {
   "id": 38,
   "plot": 38,
   "capacity": 1,
   "status": "occupied",
   "builtDay": 2,
   "occupants": [
    38
   ]
  },
  {
   "id": 39,
   "plot": 39,
   "capacity": 1,
   "status": "occupied",
   "builtDay": 2,
   "occupants": [
    39
   ]
  },
  {
   "id": 40,
   "plot": 40,
   "capacity": 1,
   "status": "occupied",
   "builtDay": 2,
   "occupants": [
    40
   ]
  },
  {
   "id": 41,
   "plot": 41,
   "capacity": 1,
   "status": "occupied",
   "builtDay": 2,
   "occupants": [
    41
   ]
  },
  {
   "id": 42,
   "plot": 42,
   "capacity": 1,
   "status": "occupied",
   "builtDay": 2,
   "occupants": [
    42
   ]
  },
  {
   "id": 43,
   "plot": 43,
   "capacity": 1,
   "status": "occupied",
   "builtDay": 2,
   "occupants": [
    43
   ]
  },
  {
   "id": 44,
   "plot": 44,
   "capacity": 1,
   "status": "occupied",
   "builtDay": 2,
   "occupants": [
    44
   ]
  },
  {
   "id": 45,
   "plot": 45,
   "capacity": 1,
   "status": "occupied",
   "builtDay": 2,
   "occupants": [
    45
   ]
  },
  {
   "id": 46,
   "plot": 46,
   "capacity": 1,
   "status": "occupied",
   "builtDay": 2,
   "occupants": [
    46
   ]
  },
  {
   "id": 47,
   "plot": 47,
   "capacity": 1,
   "status": "occupied",
   "builtDay": 2,
   "occupants": [
    47
   ]
  },
  {
   "id": 48,
   "plot": 48,
   "capacity": 1,
   "status": "occupied",
   "builtDay": 2,
   "occupants": [
    48
   ]
  },
  {
   "id": 49,
   "plot": 49,
   "capacity": 1,
   "status": "occupied",
   "builtDay": 2,
   "occupants": [
    49
   ]
  },
  {
   "id": 50,
   "plot": 50,
   "capacity": 1,
   "status": "occupied",
   "builtDay": 2,
   "occupants": [
    50
   ]
  },
  {
   "id": 51,
   "plot": 51,
   "capacity": 1,
   "status": "occupied",
   "builtDay": 2,
   "occupants": [
    51
   ]
  },
  {
   "id": 52,
   "plot": 52,
   "capacity": 1,
   "status": "occupied",
   "builtDay": 2,
   "occupants": [
    52
   ]
  },
  {
   "id": 53,
   "plot": 53,
   "capacity": 1,
   "status": "occupied",
   "builtDay": 2,
   "occupants": [
    53
   ]
  },
  {
   "id": 54,
   "plot": 54,
   "capacity": 1,
   "status": "occupied",
   "builtDay": 2,
   "occupants": [
    54
   ]
  },
  {
   "id": 55,
   "plot": 55,
   "capacity": 1,
   "status": "occupied",
   "builtDay": 2,
   "occupants": [
    55
   ]
  },
  {
   "id": 56,
   "plot": 56,
   "capacity": 1,
   "status": "occupied",
   "builtDay": 2,
   "occupants": [
    56
   ]
  },
  {
   "id": 57,
   "plot": 57,
   "capacity": 1,
   "status": "occupied",
   "builtDay": 2,
   "occupants": [
    57
   ]
  },
  {
   "id": 58,
   "plot": 58,
   "capacity": 1,
   "status": "occupied",
   "builtDay": 2,
   "occupants": [
    58
   ]
  },
  {
   "id": 59,
   "plot": 59,
   "capacity": 1,
   "status": "occupied",
   "builtDay": 2,
   "occupants": [
    59
   ]
  },
  {
   "id": 60,
   "plot": 60,
   "capacity": 1,
   "status": "occupied",
   "builtDay": 2,
   "occupants": [
    60
   ]
  },
  {
   "id": 61,
   "plot": 61,
   "capacity": 1,
   "status": "occupied",
   "builtDay": 2,
   "occupants": [
    61
   ]
  },
  {
   "id": 62,
   "plot": 62,
   "capacity": 1,
   "status": "occupied",
   "builtDay": 2,
   "occupants": [
    62
   ]
  },
  {
   "id": 63,
   "plot": 63,
   "capacity": 1,
   "status": "occupied",
   "builtDay": 2,
   "occupants": [
    63
   ]
  },
  {
   "id": 64,
   "plot": 64,
   "capacity": 1,
   "status": "occupied",
   "builtDay": 2,
   "occupants": [
    64
   ]
  },
  {
   "id": 65,
   "plot": 65,
   "capacity": 1,
   "status": "occupied",
   "builtDay": 2,
   "occupants": [
    65
   ]
  },
  {
   "id": 66,
   "plot": 66,
   "capacity": 1,
   "status": "occupied",
   "builtDay": 2,
   "occupants": [
    66
   ]
  },
  {
   "id": 67,
   "plot": 67,
   "capacity": 1,
   "status": "occupied",
   "builtDay": 2,
   "occupants": [
    67
   ]
  },
  {
   "id": 68,
   "plot": 68,
   "capacity": 1,
   "status": "occupied",
   "builtDay": 2,
   "occupants": [
    68
   ]
  },
  {
   "id": 69,
   "plot": 69,
   "capacity": 1,
   "status": "occupied",
   "builtDay": 2,
   "occupants": [
    69
   ]
  },
  {
   "id": 70,
   "plot": 70,
   "capacity": 1,
   "status": "occupied",
   "builtDay": 2,
   "occupants": [
    70
   ]
  },
  {
   "id": 71,
   "plot": 71,
   "capacity": 1,
   "status": "occupied",
   "builtDay": 2,
   "occupants": [
    71
   ]
  },
  {
   "id": 72,
   "plot": 72,
   "capacity": 1,
   "status": "occupied",
   "builtDay": 3,
   "occupants": [
    72
   ]
  },
  {
   "id": 73,
   "plot": 73,
   "capacity": 1,
   "status": "occupied",
   "builtDay": 3,
   "occupants": [
    73
   ]
  },
  {
   "id": 74,
   "plot": 74,
   "capacity": 1,
   "status": "occupied",
   "builtDay": 3,
   "occupants": [
    74
   ]
  },
  {
   "id": 75,
   "plot": 75,
   "capacity": 1,
   "status": "occupied",
   "builtDay": 3,
   "occupants": [
    75
   ]
  },
  {
   "id": 76,
   "plot": 76,
   "capacity": 1,
   "status": "occupied",
   "builtDay": 3,
   "occupants": [
    76
   ]
  },
  {